{
 "version": "aistem-scene-1",
 "id": "chemistry.thpt.cau-tao-quoc-te.ky-hieu-axe-vsepr",
 "title_vi": "Phân tử CH₄ — tứ diện đều (VSEPR AX₄)",
 "formula_id": "chemistry.thpt.cau-tao-quoc-te.ky-hieu-axe-vsepr",
 "caption_vi": "AX₄ không cặp electron riêng → hình học tứ diện đều, góc 109,5°.",
 "camera": {
  "position": [
   5.0,
   4.0,
   6.0
  ],
  "target": [
   0.0,
   0.0,
   0.0
  ],
  "fov": 45,
  "up": [
   0,
   1,
   0
  ]
 },
 "background": "auto",
 "helpers": {},
 "objects": [
  {
   "type": "sphere",
   "at": [
    0.0,
    0.0,
    0.0
   ],
   "radius": 0.5,
   "color": "#334155",
   "opacity": 1.0
  },
  {
   "type": "label",
   "at": [
    0.0,
    0.75,
    0.0
   ],
   "text": "C",
   "color": "#334155"
  },
  {
   "type": "sphere",
   "at": [
    1.05,
    1.05,
    1.05
   ],
   "radius": 0.32,
   "color": "#e2e8f0",
   "opacity": 1.0
  },
  {
   "type": "label",
   "at": [
    1.05,
    1.62,
    1.05
   ],
   "text": "H",
   "color": "#334155"
  },
  {
   "type": "sphere",
   "at": [
    1.05,
    -1.05,
    -1.05
   ],
   "radius": 0.32,
   "color": "#e2e8f0",
   "opacity": 1.0
  },
  {
   "type": "label",
   "at": [
    1.05,
    -0.48,
    -1.05
   ],
   "text": "H",
   "color": "#334155"
  },
  {
   "type": "sphere",
   "at": [
    -1.05,
    1.05,
    -1.05
   ],
   "radius": 0.32,
   "color": "#e2e8f0",
   "opacity": 1.0
  },
  {
   "type": "label",
   "at": [
    -1.05,
    1.62,
    -1.05
   ],
   "text": "H",
   "color": "#334155"
  },
  {
   "type": "sphere",
   "at": [
    -1.05,
    -1.05,
    1.05
   ],
   "radius": 0.32,
   "color": "#e2e8f0",
   "opacity": 1.0
  },
  {
   "type": "label",
   "at": [
    -1.05,
    -0.48,
    1.05
   ],
   "text": "H",
   "color": "#334155"
  },
  {
   "type": "line",
   "points": [
    [
     0.0,
     0.0,
     0.0
    ],
    [
     1.05,
     1.05,
     1.05
    ]
   ],
   "color": "#94a3b8",
   "dashed": false
  },
  {
   "type": "line",
   "points": [
    [
     0.0,
     0.0,
     0.0
    ],
    [
     1.05,
     -1.05,
     -1.05
    ]
   ],
   "color": "#94a3b8",
   "dashed": false
  },
  {
   "type": "line",
   "points": [
    [
     0.0,
     0.0,
     0.0
    ],
    [
     -1.05,
     1.05,
     -1.05
    ]
   ],
   "color": "#94a3b8",
   "dashed": false
  },
  {
   "type": "line",
   "points": [
    [
     0.0,
     0.0,
     0.0
    ],
    [
     -1.05,
     -1.05,
     1.05
    ]
   ],
   "color": "#94a3b8",
   "dashed": false
  }
 ]
}
